[{"id":"tirumbippaar-s012-d001","canonical_scene":12,"source_scene_heading":12,"speaker_label":"பூமாலை","text":"எங்கே வந்தாய்","page_provenance":[{"pdf_page":19,"printed_page":11}],"source_scene_file":"scene-12.md"},{"id":"tirumbippaar-s012-d002","canonical_scene":12,"source_scene_heading":12,"speaker_label":"பூமாலை","text":"உன்னைத்தான் கேட்கிறேன், எங்கே வந்தாய்...","page_provenance":[{"pdf_page":19,"printed_page":11}],"source_scene_file":"scene-12.md"},{"id":"tirumbippaar-s012-d003","canonical_scene":12,"source_scene_heading":12,"speaker_label":"பரந்தாமன்","text":"என் வீட்டுக்கு நான் வந்தேன்.","page_provenance":[{"pdf_page":19,"printed_page":11}],"source_scene_file":"scene-12.md"},{"id":"tirumbippaar-s012-d004","canonical_scene":12,"source_scene_heading":12,"speaker_label":"பூமாலை","text":"உன் வீட்டில் நீயே இரு-நான் போய்விடுகிறேன்.","page_provenance":[{"pdf_page":19,"printed_page":11}],"source_scene_file":"scene-12.md"},{"id":"tirumbippaar-s012-d005","canonical_scene":12,"source_scene_heading":12,"speaker_label":"பரந்தாமன்","text":"யாரும் போகவேண்டாம். நானே போகிறேன். செத்தே போகிறேன். அப்போதுதான் நீ நிம்மதியாயிருப்பாய்.","page_provenance":[{"pdf_page":19,"printed_page":11}],"source_scene_file":"scene-12.md"},{"id":"tirumbippaar-s012-d006","canonical_scene":12,"source_scene_heading":12,"speaker_label":"பூமாலை","text":"நீயேன் சாகிறாய். இன்னும் எத்தனை பெண்களின் கண்ணீர் வெள்ளத்தில் நீச்சல் விளையாட்டு நடத்த வேண்டும் நீ.","page_provenance":[{"pdf_page":19,"printed_page":11}],"source_scene_file":"scene-12.md"},{"id":"tirumbippaar-s012-d007","canonical_scene":12,"source_scene_heading":12,"speaker_label":"பரந்தாமன்","text":"போதும். நான் சாகவேண்டுமென்பதை நீ ஜாடையாகக் கூறிவிட்ட பிறகும் உயிரோடிருக்கவா போகிறேன் இல்லை,இல்லை.","page_provenance":[{"pdf_page":19,"printed_page":11}],"source_scene_file":"scene-12.md"},{"id":"tirumbippaar-s012-d008","canonical_scene":12,"source_scene_heading":12,"speaker_label":"பூமாலை","text":"பயமுறுத்தாதே / உற்சாகச் சேறு, உல்லாசச் சகதி, இவைகளிலே உடலைப் புரட்டவேண்டும் என்பதையே வாழ்க்கை லட்சியமாகக் கொண்டவர்கள் சாவை நினைக்கக் கூட பயப்படுவார்கள் என்பது எனக்குத் தெரியும்.","page_provenance":[{"pdf_page":19,"printed_page":11}],"source_scene_file":"scene-12.md"},{"id":"tirumbippaar-s012-d009","canonical_scene":12,"source_scene_heading":12,"speaker_label":"பரந்தாமன்","text":"இப்போது என்னதான் சொல்லுகிறாய்.","page_provenance":[{"pdf_page":20,"printed_page":12}],"source_scene_file":"scene-12.md"},{"id":"tirumbippaar-s012-d010","canonical_scene":12,"source_scene_heading":12,"speaker_label":"பூமாலை","text":"நானா சொல்லவேண்டும். ஊரே சொல்கிறதே ! சூதுவாதறியாத கன்னி யொருத்தியின் வாழ்வைக் களவாடிய சூதாடியின் அக்காள் இவள் தானென்று சுட்டிக்காட்டிச் சொல்கிறதே.போதும் உன்னால் வந்த வேதனை. தம்பியை ஒழுங்காகப் பார்த்துக்கொள் என்று அப்பாவும் அம்மாவும் ஆயிரம்முறை சொல்லியிருப்பார்களே. மிக ஒழுங்காகப் பார்த்துக் கொண்டேன். மிருகத்தைக்கூடப் பழக்கி விடலாமப்பா... உன்னை திருத்தவே முடியாது.","page_provenance":[{"pdf_page":20,"printed_page":12}],"source_scene_file":"scene-12.md"},{"id":"tirumbippaar-s012-d011","canonical_scene":12,"source_scene_heading":12,"speaker_label":"பரந்தாமன்","text":"உனக்கென்ன தெரியும் என் நிலைமை -அழுவாய். அதைப் பார்த்து ஊர்- அக்காள் நல்லவள் தம்பி கெட்டவன் என்று சொல்லும், உன் முகாரிக்கு முழு வெற்றி கிடைத்துவிடும்... கல்யாணம் நின்றுவிட்டதே, அதனால் விருந்து நடத்த வாங்கிய ஏராள சாமான்கள் வீணாகிவிட்டதே, பந்தல்காரனுக்குத் தந்த பணம் பாழாயிற்றே : செலவு செய்த செல்வத்தை இனி மீண்டும் சேர்க்க முடியுமா என்ற கவலை உனக்கு. எனக்கல்லவா தெரியும் பணம் வீணாகாமல் பாமா பரிணயம் முடிந்திருந்தால் பிறகு என் மனம் படும் பாடு. உனக்கு எப்படித் தெரியும். அப்பா அம்மாவா இருக்கிறார்கள் என்னைப்பற்றி கவலைபட","page_provenance":[{"pdf_page":20,"printed_page":12}],"source_scene_file":"scene-12.md"},{"id":"tirumbippaar-s012-d012","canonical_scene":12,"source_scene_heading":12,"speaker_label":"பூமாலை","text":"தம்பி அப்படியெல்லாம் சொல்லாதே. ஏன் கல்யாணத்தன்று ஓடிவிட்டாய்.","page_provenance":[{"pdf_page":20,"printed_page":12}],"source_scene_file":"scene-12.md"},{"id":"tirumbippaar-s012-d013","canonical_scene":12,"source_scene_heading":12,"speaker_label":"பரந்தாமன்","text":"பாமா பரிசுத்தமானவள் அல்ல. அவளை நம்பி மோசம் போனேன் .....","page_provenance":[{"pdf_page":20,"printed_page":12}],"source_scene_file":"scene-12.md"},{"id":"tirumbippaar-s012-d014","canonical_scene":12,"source_scene_heading":12,"speaker_label":"பூமாலை","text":"இருக்காது- யாரோ தவறாக சொல்லியிருக்கிறார்கள். பாமா பத்தரைமாற்றுப் பசும்பொன்.","page_provenance":[{"pdf_page":20,"printed_page":12}],"source_scene_file":"scene-12.md"},{"id":"tirumbippaar-s012-d015","canonical_scene":12,"source_scene_heading":12,"speaker_label":"பரந்தாமன்","text":"பொன்னல்ல- பொன் பூசிய பித்தளை.","page_provenance":[{"pdf_page":20,"printed_page":12}],"source_scene_file":"scene-12.md"},{"id":"tirumbippaar-s012-d016","canonical_scene":12,"source_scene_heading":12,"speaker_label":"பூமாலை","text":"என்னால் நம்பமுடியாது. உன் தவறுக்கு காரணம் கற்பிக்கிறாய்.","page_provenance":[{"pdf_page":20,"printed_page":12}],"source_scene_file":"scene-12.md"},{"id":"tirumbippaar-s012-d017","canonical_scene":12,"source_scene_heading":12,"speaker_label":"பரந்தாமன்","text":"(கண்டிப்பாக) நம்பவேண்டாம். எனக்குக் கல்யாணம் பிடிக்கவில்லை. அவ்வளவுதானே...","page_provenance":[{"pdf_page":21,"printed_page":13}],"source_scene_file":"scene-12.md"},{"id":"tirumbippaar-s012-d018","canonical_scene":12,"source_scene_heading":12,"speaker_label":"பூமாலை","text":"இந்த ஞானோதயம் முன்பே வந்திருக்கவேண்டும்.","page_provenance":[{"pdf_page":21,"printed_page":13}],"source_scene_file":"scene-12.md"},{"id":"tirumbippaar-s012-d019","canonical_scene":12,"source_scene_heading":12,"speaker_label":"பரந்தாமன்","text":"பெரிய பெரிய மனிதர்களுக்கே பிறகுதான் உதயமாகியிருக்கிறது. நான் என்ன சாதாரணம்...","page_provenance":[{"pdf_page":21,"printed_page":13}],"source_scene_file":"scene-12.md"},{"id":"tirumbippaar-s012-d020","canonical_scene":12,"source_scene_heading":12,"speaker_label":"ஒரு குழந்தை","text":"அக்கா, அக்கா, அம்புஜம் சொல்றா,நாய் வாலை நிமிர்க்க முடியாதாம். நிஜந்தானா அக்கா!","page_provenance":[{"pdf_page":21,"printed_page":13}],"source_scene_file":"scene-12.md"},{"id":"tirumbippaar-s012-d021","canonical_scene":12,"source_scene_heading":12,"speaker_label":"பூமாலை","text":"ஆமாம் சரி வாங்க படிக்கலாம்","page_provenance":[{"pdf_page":21,"printed_page":13}],"source_scene_file":"scene-12.md"}]