[
  {"id":"tirumbippaar-s042-d001","canonical_scene":42,"source_scene_heading":42,"speaker_label":"குமுதா","text":"என்ன திடீரென்று எழுத்து ஆரம்பித்துவிட்டீர்கள்?","page_provenance":[{"pdf_page":57,"printed_page":49}],"source_scene_file":"scene-42.md"},
  {"id":"tirumbippaar-s042-d002","canonical_scene":42,"source_scene_heading":42,"speaker_label":"பாண்டியன்","text":"நல்ல சிச்சுவேஷன் கிடைத்தது பாட்டு எழுதுகிறேன்.","page_provenance":[{"pdf_page":57,"printed_page":49}],"source_scene_file":"scene-42.md"},
  {"id":"tirumbippaar-s042-d003","canonical_scene":42,"source_scene_heading":42,"speaker_label":"குமுதா","text":"எந்தப் பத்திரிகைக்கு?","page_provenance":[{"pdf_page":57,"printed_page":49}],"source_scene_file":"scene-42.md"},
  {"id":"tirumbippaar-s042-d004","canonical_scene":42,"source_scene_heading":42,"speaker_label":"பாண்டியன்","text":"நான் எந்தப் பத்திரிகைக்கு எழுதுவேன்...","page_provenance":[{"pdf_page":57,"printed_page":49}],"source_scene_file":"scene-42.md"},
  {"id":"tirumbippaar-s042-d005","canonical_scene":42,"source_scene_heading":42,"speaker_label":"குமுதா","text":"எங்கே பாட்டைக் கேட்கலாம்....","page_provenance":[{"pdf_page":57,"printed_page":49}],"source_scene_file":"scene-42.md"}
]
