[
  {"id":"tirumbippaar-s092-d001","canonical_scene":92,"source_scene_heading":92,"speaker_label":"நீதிபதி","text":"(ஜட்ஜ்மெண்ட் படிக்கப்படுகிறது) பத்திரிகை மூலமாக செய்தி கேள்விப்பட்டுதான் பாண்டியன் வந்திருக்கிறார்! கொலைக்கும் அவருக்கும் எந்த சம்பந்தமும் இல்லை என்பது சிவசக்தி மில் முதலாளியின் சாட்சியத்தாலும், ஆஸ்பத்திரி வாட்ச்மேன் சாட்சியத்தாலும் தெளிவாகிறது. பரந்தாமனுக்கும் பாண்டியனுக்கும் விரோதம் என்கிற காரணத்தாலேயே கொலைசெய்தார் என்பது நம்பத்தகுந்ததல்ல! ஆகவே பாண்டியன் விடுதலை செய்யப்படுகிறார். (பூமால் புன்னகை) கொலை குற்றத்தை ஒப்புக்கொள்ளும் பூமாலிக்கு மரண தண்டனை விதிக்கப்படுகிறது.","page_provenance":[{"pdf_page":111,"printed_page":103}],"source_scene_file":"scene-92.md"},
  {"id":"tirumbippaar-s092-d002","canonical_scene":92,"source_scene_heading":92,"speaker_label":"குமுதா","text":"சின்னம்மா!","page_provenance":[{"pdf_page":111,"printed_page":103}],"source_scene_file":"scene-92.md"}
]
