[
  {"id":"tirumbippaar-s072-d001","canonical_scene":72,"source_scene_heading":72,"speaker_label":"பரந்தாமன்","text":"ஏ இங்கே வா! அட காசு வாங்கு! (ஒரு ரூபாய் நாணயத்தை எடுத்து வீசுகிறான்) வாங்கிறேன்ல!\nவாரியா நான் வரட்டுமா? (எழுந்து வந்து) அன்புக்கரசி! அழகு மணி மாளிகையின் அலங்காரத் திருவுருவே! அழித்தெழுதாச் சித்திரமே! (திரையில் குரல்)","page_provenance":[{"pdf_page":87,"printed_page":79},{"pdf_page":88,"printed_page":80}],"page_segments":[{"pdf_page":87,"printed_page":79,"text":"ஏ இங்கே வா! அட காசு வாங்கு! (ஒரு ரூபாய் நாணயத்தை எடுத்து வீசுகிறான்) வாங்கிறேன்ல!"},{"pdf_page":88,"printed_page":80,"text":"வாரியா நான் வரட்டுமா? (எழுந்து வந்து) அன்புக்கரசி! அழகு மணி மாளிகையின் அலங்காரத் திருவுருவே! அழித்தெழுதாச் சித்திரமே! (திரையில் குரல்)"}],"source_scene_file":"scene-72.md"},
  {"id":"tirumbippaar-s072-d002","canonical_scene":72,"source_scene_heading":72,"speaker_label":"குரல்","text":"அழுத்தெழுதாச் சித்திரமே! ஆடிவரும் பொன் விளக்கே! கட்டாணி முத்தழகி! கண்கவரும் ரத்தினமே!","page_provenance":[{"pdf_page":88,"printed_page":80}],"source_scene_file":"scene-72.md"},
  {"id":"tirumbippaar-s072-d003","canonical_scene":72,"source_scene_heading":72,"speaker_label":"பரந்தாமன்","text":"ஆ! யார்? (பாமா வெளிப்படுகிறாள்)","page_provenance":[{"pdf_page":88,"printed_page":80}],"source_scene_file":"scene-72.md"},
  {"id":"tirumbippaar-s072-d004","canonical_scene":72,"source_scene_heading":72,"speaker_label":"பரந்தாமன்","text":"ஆ! பாமா!","page_provenance":[{"pdf_page":88,"printed_page":80}],"source_scene_file":"scene-72.md"},
  {"id":"tirumbippaar-s072-d005","canonical_scene":72,"source_scene_heading":72,"speaker_label":"பாமா","text":"நானேதான்! அன்புக்கரசி என வர்ணித்தாயே அந்த அரசியின் தாசி வேஷத்தைப் பார்! அழகு மணி மாளிகையின் அலங்காரத் திருவுருவம்! சமுதாயக் குட்டிச் சுவரின் நிழலில் சுருங்கி விழுந்து உருக் குலைந்து கிடப்பதைப் பார்! அழித்தெழுதாச் சித்திரம்! நாள்தோறும் இங்கு நடமாடும் புதுப் புது ஓவியக் கலை ரசிகர்களால் திருத்தி எழுதப்பட்டு தெருவில் நாசமாகிக் கிடப்பதைப் பார்! ஆடிவரும் பொன் விளக்கு! அனுதினமும் தேடி வரும் ஆண்கள் கையில் அகப்பட்டு அணைந்து கிடப்பதைப் பார்! கட்டாணி முத்தழகி! மொட்டாகவே கருகிவிட்டதைப் பார்! கண்கவரும் ரத்தினத்தில், மண் படிந்து கிடப்பதைப் பார்! கயவனே, காதகனே? கவிதை பேசிய காதற் புலவனே! பார் ... பார் ... பார் ... பார்?","page_provenance":[{"pdf_page":88,"printed_page":80}],"source_scene_file":"scene-72.md"},
  {"id":"tirumbippaar-s072-d006","canonical_scene":72,"source_scene_heading":72,"speaker_label":"பரந்தாமன்","text":"பாமா பொறு! போனதை மறந்துவிடு!","page_provenance":[{"pdf_page":88,"printed_page":80}],"source_scene_file":"scene-72.md"},
  {"id":"tirumbippaar-s072-d007","canonical_scene":72,"source_scene_heading":72,"speaker_label":"பாமா","text":"மறப்பதா! என் மானமே போய்விட்டதடா மகா பாவி!","page_provenance":[{"pdf_page":88,"printed_page":80}],"source_scene_file":"scene-72.md"},
  {"id":"tirumbippaar-s072-d008","canonical_scene":72,"source_scene_heading":72,"speaker_label":"பரந்தாமன்","text":"மானத்தை இழக்க நீ தானே காரணம்!....","page_provenance":[{"pdf_page":88,"printed_page":80}],"source_scene_file":"scene-72.md"},
  {"id":"tirumbippaar-s072-d009","canonical_scene":72,"source_scene_heading":72,"speaker_label":"பாமா","text":"ஆமாம். உன் காதல் மாளிகையிலே, கனகமணி கட்டிலிலே, உல்லாச உப்பரிகையிலே, ஒய்யார கீதம் பாடியபடி அல்லும் பகலும் இணையாத அன்புத் தெய்வமாக வைத்திருந்தாய். நான்தான் அவமானச் சாக்கடையில் தொப்பென்று குதித்து கல்லாக மாறிவிட்டேன்! அப்படித்தானே!","page_provenance":[{"pdf_page":88,"printed_page":80}],"source_scene_file":"scene-72.md"},
  {"id":"tirumbippaar-s072-d010","canonical_scene":72,"source_scene_heading":72,"speaker_label":"பரந்தாமன்","text":"விதியின் விளையாட்டு எல்லாம்!","page_provenance":[{"pdf_page":89,"printed_page":81}],"source_scene_file":"scene-72.md"},
  {"id":"tirumbippaar-s072-d011","canonical_scene":72,"source_scene_heading":72,"speaker_label":"பாமா","text":"விதி!","page_provenance":[{"pdf_page":89,"printed_page":81}],"source_scene_file":"scene-72.md"},
  {"id":"tirumbippaar-s072-d012","canonical_scene":72,"source_scene_heading":72,"speaker_label":"பரந்தாமன்","text":"ஆம் விதி! ஒரு விபரீதமான பாரசூட்! அதைப் பிடித்துக்கொண்டால் அது எங்கு இறக்கி விடுகிறதோ அங்குதான் இறங்க வேண்டும்!","page_provenance":[{"pdf_page":89,"printed_page":81}],"source_scene_file":"scene-72.md"},
  {"id":"tirumbippaar-s072-d013","canonical_scene":72,"source_scene_heading":72,"speaker_label":"பாமா","text":"அறியாமை என்ற ஆகாய விமானத்தில் ஏறியவர்களுக்குத்தான் அந்தப் பாராசூட் தேவைப்படும்! அப்படி ஏறிய முட்டாள் நான்தான்! முட்டாள் நான்தான்!","page_provenance":[{"pdf_page":89,"printed_page":81}],"source_scene_file":"scene-72.md"},
  {"id":"tirumbippaar-s072-d014","canonical_scene":72,"source_scene_heading":72,"speaker_label":"பரந்தாமன்","text":"நீ பழைய சாஸ்திரங்கள் படித்ததில்ல.","page_provenance":[{"pdf_page":89,"printed_page":81}],"source_scene_file":"scene-72.md"},
  {"id":"tirumbippaar-s072-d015","canonical_scene":72,"source_scene_heading":72,"speaker_label":"பாமா","text":"எங்கே அந்த சாஸ்திரங்களை கொண்டுவா! ஆணுக்கோர் நீதி பெண்ணுக்கோர் நீதி சொல்லும் அந்த அக்கிரம சாஸ்திரத்தைக்கொளுத்தி அந்த நெருப்பிலேயே உன்னையும் போட்டு வேக வைக்கிறேன், துரோகி!","page_provenance":[{"pdf_page":89,"printed_page":81}],"source_scene_file":"scene-72.md"},
  {"id":"tirumbippaar-s072-d016","canonical_scene":72,"source_scene_heading":72,"speaker_label":"பரந்தாமன்","text":"பாமா! வேசியாக மாறியதுமல்லாமல் அதை மறைக்க வேகமாகவும் பேசுகிறாய்!","page_provenance":[{"pdf_page":89,"printed_page":81}],"source_scene_file":"scene-72.md"},
  {"id":"tirumbippaar-s072-d017","canonical_scene":72,"source_scene_heading":72,"speaker_label":"பாமா","text":"ஆம், வேசிதான். ஆனால், மறந்து விட மாட்டேன் உன்னுடைய மாஜி காதலி என்பதை! ஏனடா வேசியாக மாறினேன்? வேடிக்கை விநோதங்களில் காலத்தைக் கழிக்கவா? இல்ல. இல்லையடா இல்ல. வெந்துகொண்டிருக்கும் என் உள்ளத்திலிருந்து கிளம்பும் தீ ஜ்வாலைக்கு உன்னை இரையாக்க! வேதனைக் கனலிலே கூர் தீட்டப்பட்ட வேல் முனைக்கு உன்னை விருந்தாக்க! பாமா பரத்தைக் கோலம் பூண்டது பணம் சம்பாதிக்க அல்ல. உயிர் வாழ. உயிர் வாழ்வது சாகப் பயந்து அல்ல. சண்டாள பரந்தாமனை பழிவாங்க! பழிக்குப் பழி வாங்க! இதோ பாமாவின் காரியம் முடிந்துவிட்டது. எண்ணம் ஈடேறி விட்டது! ஈடேறி விட்டது!","page_provenance":[{"pdf_page":89,"printed_page":81}],"source_scene_file":"scene-72.md"}
]
