[{"id":"tirumbippaar-s016-d001","canonical_scene":16,"source_scene_heading":16,"speaker_label":"கருடன்","text":"சிங்க நல்லூர் சிவசக்தி மில்ஸ் மேஸ்திரி புண்யகோடியின் மகன் எழுத்தாளர் பாண்டியனுக்கும், கோவை மெர்ச்சண்ட் குணரத்னம் திருச் செல்வி பாமாவுக்கும் திருமண விழா மணமகள் இல்லத்தில் சிறப்பாக நடைபெறும். தங்கள் சுற்றமும்.....","page_provenance":[{"pdf_page":24,"printed_page":16}],"source_scene_file":"scene-16.md"},{"id":"tirumbippaar-s016-d002","canonical_scene":16,"source_scene_heading":16,"speaker_label":"கருடன்","text":"அந்தப் பயல் பாண்டியன் நம்ப விஷயத்திலே குறுக்கிட்டு கொண்டேயிருக்கிறான். அன்னைக்கு என்னடான்னா நாடகம் நடத்தி நம்ம கொள்கையை கிண்டல் பண்றான். இன்னைக்கு என்னடான்னா நம்ப கல்யாணம் பண்ணிக்க வேண்டிய பெண்ணை ..","page_provenance":[{"pdf_page":24,"printed_page":16}],"source_scene_file":"scene-16.md"},{"id":"tirumbippaar-s016-d003","canonical_scene":16,"source_scene_heading":16,"speaker_label":"பரந்தாமன்","text":"ஏய் ...","page_provenance":[{"pdf_page":24,"printed_page":16}],"source_scene_file":"scene-16.md"},{"id":"tirumbippaar-s016-d004","canonical_scene":16,"source_scene_heading":16,"speaker_label":"கருடன்","text":"இல்லை. நீ கல்யாணம் பண்ணிக்க வேண்டிய பெண்ணை ...","page_provenance":[{"pdf_page":24,"printed_page":16}],"source_scene_file":"scene-16.md"},{"id":"tirumbippaar-s016-d005","canonical_scene":16,"source_scene_heading":16,"speaker_label":"பரந்தாமன்","text":"யார் விட்டார்கள்.","page_provenance":[{"pdf_page":24,"printed_page":16}],"source_scene_file":"scene-16.md"}]
