[{"id":"tirumbippaar-s024-d001","canonical_scene":24,"source_scene_heading":24,"speaker_label":"பாமா","text":"நீலக்கடல் நேர்த்தியான காட்சி!","page_provenance":[{"pdf_page":31,"printed_page":23}],"source_scene_file":"scene-24.md"},{"id":"tirumbippaar-s024-d002","canonical_scene":24,"source_scene_heading":24,"speaker_label":"பரந்தாமன்","text":"இந்தக் கடல் திடீரென்று பொங்கிவிட்டால்..","page_provenance":[{"pdf_page":31,"printed_page":23}],"source_scene_file":"scene-24.md"},{"id":"tirumbippaar-s024-d003","canonical_scene":24,"source_scene_heading":24,"speaker_label":"பாமா","text":"அழகுக்குப் பக்கத்தில் எப்போதும் ஆபத்து இருக்கும்.","page_provenance":[{"pdf_page":31,"printed_page":23}],"source_scene_file":"scene-24.md"},{"id":"tirumbippaar-s024-d004","canonical_scene":24,"source_scene_heading":24,"speaker_label":"பரந்தாமன்","text":"இது பலருக்குப் புரிவதேயில்லை.","page_provenance":[{"pdf_page":31,"printed_page":23}],"source_scene_file":"scene-24.md"}]
