[
  {"id":"tirumbippaar-s081-d001","canonical_scene":81,"source_scene_heading":81,"speaker_label":"பரந்தாமன்","text":"பரந்தாமா! பாவி ! உனக்கு இந்த தண்டனை போதாது. இன்னும் வேண்டும். இன்னும் வேண்டும்.","page_provenance":[{"pdf_page":98,"printed_page":90}],"source_scene_file":"scene-81.md"},
  {"id":"tirumbippaar-s081-d002","canonical_scene":81,"source_scene_heading":81,"speaker_label":"Echo","text":"வானத்திலே பல நட்சத்திரங்கள்- ஒரே நிலவு- வையகத்திலே உனக்குப் பல சகோதரிகள் - ஒரே மனைவி - ஒரே மனைவி.","page_provenance":[{"pdf_page":98,"printed_page":90}],"source_scene_file":"scene-81.md"},
  {"id":"tirumbippaar-s081-d003","canonical_scene":81,"source_scene_heading":81,"speaker_label":"பரந்தாமன்","text":"அக்கா ! அன்பின் சிகரமே ! என்னை மன்னித்து விடுங்கள். நான் பகுத்தறிவாளனாகி விட்டேன். பகுத்தறிவாளனாகி விட்டேன். திரும்பிப்பார் - எனக்கு மட்டுமல்ல - உலகத்திற்கே என் அக்காள் வழங்கிய ஒப்பற்ற உபதேசம்.திரும்பிப்பார் - ஏ மாஜி மனிதனே - மகா பாதகனே - நீயும் திரும்பிப்பார். நீ உருண்டு வந்த சாலையிலே அள்ளித் தெளித்திருக்கும் மண்டையோடுங்கள் எத்தனை? பிழிந்தெறியப்பட்ட இருதயச் சக்கைகளின் தொகை எவ்வளவு? எண்ணிப்பார்.இழிவு நிறைந்தவனே திரும்பிப்பார். ஏ, மானிட ஜாதியே நீ குரங்கிலிருந்து வளர்ந்தாயாம்-அந்தக் குரங்கு மனப்பான்மை உன்னை விட்டு குறைந்துவிட்டதா என்று ஒருமுறை திரும்பிப்பார்- திரும்பிப் பார் - திரும்பிப் பார் - அக்கா ! நான் திரும்பிப் பார்த்துவிட்டேன் அக்கா ! திருந்திவிட்டேன் அக்கா !","page_provenance":[{"pdf_page":98,"printed_page":90}],"source_scene_file":"scene-81.md"}
]
