[{"id":"tirumbippaar-s038-d001","canonical_scene":38,"source_scene_heading":38,"speaker_label":"குரல்","text":"கல்யாணத்தன்று ஒரு பெண் ஏமாற்றிவிட்டாள். காதலுக்காக இரண்டு பெண்கள் போட்டி போடுகிறார்கள். கம்பூன்றி நடக்கும் ஒரு கிழவனின் கட்டிலறை ஒரு பெண்ணுக்கு வெட்டுப்பாறையாகப் போகிறது. வேடிக்கையும் வேதனையும் நிறைந்த பெண் சமுதாயம்!","page_provenance":[{"pdf_page":49,"printed_page":41}],"source_scene_file":"scene-38.md"},{"id":"tirumbippaar-s038-d002","canonical_scene":38,"source_scene_heading":38,"speaker_label":"பாண்டியன்","text":"பூமாலை!","page_provenance":[{"pdf_page":49,"printed_page":41}],"source_scene_file":"scene-38.md"},{"id":"tirumbippaar-s038-d003","canonical_scene":38,"source_scene_heading":38,"speaker_label":"பூமாலை","text":"(நெஞ்சடைக்க) மன்னித்து விடுங்கள் என்னை !.. உங்கள் மனதைக் குழப்பி விட்டேன்.","page_provenance":[{"pdf_page":49,"printed_page":41}],"source_scene_file":"scene-38.md"},{"id":"tirumbippaar-s038-d004","canonical_scene":38,"source_scene_heading":38,"speaker_label":"பாண்டியன்","text":"நீதான் என்னை மன்னிக்கவேண்டும்! துல்யமான உன் வெள்ளை இருதயத்தில் காதல் என்னும் கரும்புள்ளி ஏற்பட நான்தான் காரணமாயிருந்தேன்","page_provenance":[{"pdf_page":49,"printed_page":41}],"source_scene_file":"scene-38.md"},{"id":"tirumbippaar-s038-d005","canonical_scene":38,"source_scene_heading":38,"speaker_label":"பூமாலை","text":"காதல் கரும்புள்ளியல்ல. எட்டாத திராக்ஷை புளிக்குமா பாண்டியன்! (வேதனை)குமுதா,உங்கள் இதயம் கவர்ந்தவள் ! அவளை ஏற்றுக்கொள்ளுங்கள்!","page_provenance":[{"pdf_page":49,"printed_page":41}],"source_scene_file":"scene-38.md"},{"id":"tirumbippaar-s038-d006","canonical_scene":38,"source_scene_heading":38,"speaker_label":"பாண்டியன்","text":"என் வாழ்க்கை ஒரு போட்டி மேடை! பூகம்பம்! அதில் குமுதா போன்ற பூந்தோட்டங்கள் சிக்கி சீரழிய வேண்டாம்!..","page_provenance":[{"pdf_page":49,"printed_page":41}],"source_scene_file":"scene-38.md"},{"id":"tirumbippaar-s038-d007","canonical_scene":38,"source_scene_heading":38,"speaker_label":"பூமாலை","text":"இனியும் போட்டிமேடையல்ல. பூமாலை தோல்வியை ஒப்புக்கொண்டு விட்டாள். அதனால் பூகம்பமும் அல்ல; புது மணம் வாரிவரும் தென்றல் - குமுதா உங்களை அழைக்கிறாள், அதனால்...","page_provenance":[{"pdf_page":50,"printed_page":42}],"source_scene_file":"scene-38.md"},{"id":"tirumbippaar-s038-d008","canonical_scene":38,"source_scene_heading":38,"speaker_label":"பாண்டியன்","text":"(வருத்தமுடன்) பூமாலை...","page_provenance":[{"pdf_page":50,"printed_page":42}],"source_scene_file":"scene-38.md"},{"id":"tirumbippaar-s038-d009","canonical_scene":38,"source_scene_heading":38,"speaker_label":"பூமாலை","text":"(தீர்மானமாக சோகமுடன்) பாண்டியன், என் காதலை தியாகம் செய்துவிட்டேன். என் குமுதாவுக்காக!","page_provenance":[{"pdf_page":50,"printed_page":42}],"source_scene_file":"scene-38.md"},{"id":"tirumbippaar-s038-d010","canonical_scene":38,"source_scene_heading":38,"speaker_label":"பாண்டியன்","text":"காதலை தியாகம் செய்ய உனக்கு மட்டுந்தானா உரிமை ? எனக்குமிருக்கிறது.","page_provenance":[{"pdf_page":50,"printed_page":42}],"source_scene_file":"scene-38.md"},{"id":"tirumbippaar-s038-d011","canonical_scene":38,"source_scene_heading":38,"speaker_label":"பூமாலை","text":"வேண்டாம்- என் குமுதாவை ஏற்றுக்கொள்ளுங்கள்! அவளை ஏமாற்றி விடாதீர்கள் ! சோகத்தை சுமந்து கொள்ளும் வலிமை அவளுக்குக் கிடையாது! உங்களை மன்றாடிக் கேட்டுக்கொள்கிறேன். என் தவறுகளை மறந்து விடுங்கள் ! வாருங்கள் வீட்டுக்கு!","page_provenance":[{"pdf_page":50,"printed_page":42}],"source_scene_file":"scene-38.md"},{"id":"tirumbippaar-s038-d012","canonical_scene":38,"source_scene_heading":38,"speaker_label":"பாண்டியன்","text":"பூமாலை...","page_provenance":[{"pdf_page":50,"printed_page":42}],"source_scene_file":"scene-38.md"},{"id":"tirumbippaar-s038-d013","canonical_scene":38,"source_scene_heading":38,"speaker_label":"பூமாலை","text":"சந்தோஷமாகத்தான் அழைக்கிறேன்! கண்மணி குமுதாவின் கண்ணீரைத் துடையுங்கள் ! அவள் வாழ்ந்தால் போதும் எனக்கு ! வாருங்கள்....","page_provenance":[{"pdf_page":50,"printed_page":42}],"source_scene_file":"scene-38.md"}]
