[
  {"id":"tirumbippaar-s089-d001","canonical_scene":89,"source_scene_heading":89,"speaker_label":"பூமால்","text":"(ஆபீஸ் பையனிடம்) பரந்தாமன் எங்கே?","page_provenance":[{"pdf_page":106,"printed_page":98}],"source_scene_file":"scene-89.md"},
  {"id":"tirumbippaar-s089-d002","canonical_scene":89,"source_scene_heading":89,"speaker_label":"பையன்","text":"குமுதாகிட்ட போயிருக்கிறாரு.","page_provenance":[{"pdf_page":106,"printed_page":98}],"source_scene_file":"scene-89.md"},
  {"id":"tirumbippaar-s089-d003","canonical_scene":89,"source_scene_heading":89,"speaker_label":"பூமால்","text":"அட்ரஸ்...","page_provenance":[{"pdf_page":106,"printed_page":98}],"source_scene_file":"scene-89.md"},
  {"id":"tirumbippaar-s089-d004","canonical_scene":89,"source_scene_heading":89,"speaker_label":"பையன்","text":"இதோ அவுங்க அடிச்ச தந்தி!","page_provenance":[{"pdf_page":106,"printed_page":98}],"source_scene_file":"scene-89.md"}
]
