[
  {"id":"tirumbippaar-s050-d001","canonical_scene":50,"source_scene_heading":50,"speaker_label":"பாண்டியன்","text":"குண்டுமணி எல்லாம் பிரின்ட் ஆயிட்டுதா...","page_provenance":[{"pdf_page":65,"printed_page":57}],"source_scene_file":"scene-50.md"},
  {"id":"tirumbippaar-s050-d002","canonical_scene":50,"source_scene_heading":50,"speaker_label":"குண்டுமணி","text":"ஆயிட்டுதுங்க. இதோ மூணு காப்பி எடுத்தாந்திருக்கேன். (கொடுக்க)","page_provenance":[{"pdf_page":66,"printed_page":58}],"source_scene_file":"scene-50.md"},
  {"id":"tirumbippaar-s050-d003","canonical_scene":50,"source_scene_heading":50,"speaker_label":"குமுதா","text":"இந்தப் புஸ்தகத்தைப் பார்த்தா பரந்தாமனுக்கு ஆத்திரம் வரும்.","page_provenance":[{"pdf_page":66,"printed_page":58}],"source_scene_file":"scene-50.md"},
  {"id":"tirumbippaar-s050-d004","canonical_scene":50,"source_scene_heading":50,"speaker_label":"பாண்டியன்","text":"ஆத்திரம் வருவதற்கு இதை எழுதவில்லை. பரந்தாமன் போன்ற போலித் தலைவர்கள் அறிவு பெறுவதற்காக. அப்பாவி மக்களை ஏமாற்றுவதை நிறுத்துவதற்காக. குமுதா! இனியும் இந்த பூமியில் ஏமாளிகளும் இருக்கக் கூடாது ! இளிச்சவாயர்களும் இருக்கக்கூடாது.","page_provenance":[{"pdf_page":66,"printed_page":58}],"source_scene_file":"scene-50.md"},
  {"id":"tirumbippaar-s050-d005","canonical_scene":50,"source_scene_heading":50,"speaker_label":"குண்டுமணி","text":"இளிச்சவாயர் என்றால் எப்ப பாத்தாலும் சிரிச்சிக்கிட்டே இருக்காங்களே அவங்களாங்க? (குமுதா சிரிப்பு )","page_provenance":[{"pdf_page":66,"printed_page":58}],"source_scene_file":"scene-50.md"},
  {"id":"tirumbippaar-s050-d006","canonical_scene":50,"source_scene_heading":50,"speaker_label":"பாண்டியன்","text":"இளிச்சவாயர் என்றால் அவர்களல்ல. புரட்டுக்காரர்களின் புன்சிரிப்பிலே புத்தியை பறிகொடுத்து, எந்த இழிவு வந்தாலும் எமக்கு என்னவென்று கவலைப்படாமல், ஏன், எப்படி என்று கேட்க தைரியமில்லாமல் வாயை இறுக மூடிக்கொண்டு கிடக்கிறார்களே அவர்கள் தான் இளிச்சவாயர்கள்!","page_provenance":[{"pdf_page":66,"printed_page":58}],"source_scene_file":"scene-50.md"}
]
